<?xml version="1.0" encoding="utf-8"?>
<CoffeeHouse xmlns:xsi="http://www.w3.org/2001/XMLSchema-instance"
  xsi:noNamespaceSchemaLocation="file:/C:/Users/Bibi/Desktop/ASP/asp-proekt-novo-novo/XmlSample/App_Data/coffeeHouse.xsd" id="8">
  <name>Лед кафе</name>
  <working_time>от 8 до 22</working_time>
  <products>
    <product id="П80">
      <price>4лв.</price>
      <product_name>Студени кафета</product_name>
      <coffee id="Cвс4е30" supplement_type="Без" drink_type="Студена">
        <coffee_name>Лате малина</coffee_name>
        <coffee_type>Нескафе</coffee_type>
      </coffee>
      <coffee id="К801" supplement_type="Без" drink_type="Студена">
        <coffee_name>Лате ягода</coffee_name>
        <coffee_type>Нескафе</coffee_type>
      </coffee>
      <coffee id="К802" supplement_type="Захар" drink_type="Студена">
        <coffee_name>Фрапе</coffee_name>
        <coffee_type>Нескафе</coffee_type>
        <supplement_price>0.5лв</supplement_price>
      </coffee>
    </product>
    <product id="П81">
      <price>6лв.</price>
      <product_name>Сладолед</product_name>
      <food id="Х810" food_type="Сладко">
        <food_name>Сладолед горски плод на клечка</food_name>
      </food>
      <food id="Х811" food_type="Сладко">
        <food_name>Шоколадова фантазия</food_name>
      </food>
      <food id="Х812" food_type="Сладко">
        <food_name>Сладолед ванилия на клечка</food_name>
      </food>
    </product>
  </products>
  <contacts id="C8">
    <location id="Л8">
      <country>България</country>
      <city>Варна</city>
      <street>Хеог</street>
      <building_number>3424</building_number>
    </location>
    <phone>08765432</phone>
    <website>Лед-кафе.ком</website>
    <e-mail>Лед@кафе</e-mail>
  </contacts>
  <employees>
    <employee id="E80" position="Продавач" sex="Мъж">
      <emp_name>Силвестър</emp_name>
      <salary>600</salary>
      <age>30</age>
    </employee>
    <employee id="E81" position="Продавач" sex="Жена">
      <emp_name>Тошка</emp_name>
      <salary>983</salary>
      <age>32</age>
    </employee>
  </employees>
</CoffeeHouse>