<?xml version="1.0" encoding="utf-8"?>
<CoffeeHouse xmlns:xsi="http://www.w3.org/2001/XMLSchema-instance"
    xsi:noNamespaceSchemaLocation="file:/C:/Users/Bibi/Desktop/ASP/asp-proekt-novo-novo/XmlSample/App_Data/coffeeHouse.xsd" id = "2">
    <name>Сладко Кафе</name>
    <working_time>От 06 до 20</working_time>
    <products>
        <product id="П20">
            <price>4.50лв.</price>
            <product_name>Сладкиши</product_name>
            <description>
                Селекция от сладкиши направени с най-добрите съставки по традиционни рецепти от цял свят. 
                В перфектна комбинация с вашето сутрешно кафе, лесни за консумация, докато сте в движение и засищащи. Възхитителни и вкусни!
            </description>
            <food id="Х07" food_type = "Сладко">
                <food_name>Бисквити</food_name>
            </food>
            <food id="Х08" food_type = "Сладко">
                <food_name>Кексчета</food_name>
            </food>
            <food id="Х09" food_type = "Сладко">
                <food_name>Торти</food_name>
            </food>
            <food id="Х10" food_type = "Сладко">
                <food_name>Сладолед</food_name>
            </food>
            <image>сладко.jpg</image>
        </product>
            <product id="П21">
                <price>5.50лв.</price>
                <product_name>Палачинки</product_name>
                <description>
                    Че палачинките са любима закуска на малки и големи няма никакъв спор. 
                    Сигурно на пръсти се броят хората, които не ги обичат.
                    Със сиренце, сладко, конфитюр, шоколад, кашкавал или каквото там обичате,
                    те са вкусни, мекички, наслада за небцето и сетивата.
                </description>
                <food id="Х200" food_type = "Сладко">
                    <food_name>Палачинки с плодове</food_name>
                </food>
                <food id="Х201" food_type = "Сладко">
                    <food_name>Палачинки с шоколад</food_name>
                </food>
                <food id="Х202" food_type = "Солено">
                    <food_name>Палачинки с филе</food_name>
                </food>
                <image>палачинки.jpg</image>
            </product>
            <product id="П22">
                <price>4.50лв.</price>
                <product_name>Солени храни</product_name>
                <description>
                    Ръчно приготвени по оригинални рецепти на, пресни и сочни всеки ден, 
                    за възможно най-добрия старт на деня в комбинация с хубаво кафе!
                </description>
             <food  id="Х2024" food_type = "Солено">
                 <food_name>Кроасани</food_name>
             </food>
            <food id="Х2025" food_type = "Солено">
                <food_name>Мини сандвичи</food_name>
            </food>
            <food id="Х2026" food_type = "Солено">
                <food_name>Закуски</food_name>
            </food>
            <image>закуски.jpg</image>
        </product>
    </products>
    <contacts id="С09">
        <location id="Л090">
            <country>България</country>
            <city>София</city>
            <street>Витошка</street>
            <building_number>876р</building_number>
        </location>
        <phone>0889 876 432</phone>
        <website>СладкоКафе.ком</website>
        <e-mail>СладкоКафе@имейл.ком</e-mail>
    </contacts>
    <employees>
        <employee id="Е02" position="Готвач" sex="Мъж">
            <emp_name>Димитър Ангелов</emp_name>
            <salary>1000</salary>
            <age>28</age>
        </employee>
    </employees>
</CoffeeHouse>