<?xml version="1.0" encoding="UTF-8"?>
<CoffeeHouse xmlns:xsi="http://www.w3.org/2001/XMLSchema-instance"
 xsi:noNamespaceSchemaLocation="file:/C:/Users/Bibi/Desktop/ASP/asp-proekt-novo-novo/XmlSample/App_Data/coffeeHouse.xsd" id="19">
    <name>Чайка</name>
    <working_time>от 7:00 - до 20:00</working_time>
    <products>
        <product id="п190">
            <price>5.50лв.</price>
            <product_name>Кроасани</product_name>
            <description>
			Ръчно приготвени по оригинални рецепти на, пресни и сочни всеки ден, 
                    за възможно най-добрия старт на деня в комбинация с хубаво кафе!
			</description>
            <food id="X1901" food_type="Солено">
              <food_name>Кроасан с плодове</food_name>
            </food>
            <food id="X1902" food_type="Солено">
              <food_name>Кроасан със сирене</food_name>
            </food>
			      <food id="X1903" food_type="Солено">
              <food_name>Кроасан с шунка и кашкавал</food_name>
            </food>
			     <food id="X1904" food_type="Солено">
              <food_name>Кроасан с шунка и топено сирене</food_name>
            </food>
            <food id="X1905" food_type="Солено">
              <food_name>Кроасан с шоколад</food_name>
            </food>
            <food id="X1906" food_type="Солено">
              <food_name>Кроасан със сладко</food_name>
            </food>
            <food id="X1907" food_type="Солено">
              <food_name>Кроасан с масло</food_name>
            </food>
        </product>
        <product id="п191">
            <price>2лв</price>
            <product_name>Kафе</product_name>
            <description>най-яките кафета! Традиционни</description>
          <coffee id="к1910" drink_type ="Гореща" supplement_type = "Сметана">
              <coffee_name>Виенско кафе</coffee_name>
              <coffee_type>Cararro</coffee_type>
              <supplement_price>0.10лв</supplement_price>
            </coffee>
          <coffee id="к1911" drink_type ="Гореща" supplement_type = "Канела">
              <coffee_name>Капучно с канела</coffee_name>
              <coffee_type>Cararro</coffee_type>
              <supplement_price>0.50лв</supplement_price>
            </coffee>
        </product>
    </products>
    <contacts id="c19">
        <location id="Л19">
            <country>България</country>
            <city>София</city>
            <street>Граф Игнатиев</street>
            <building_number>65Д</building_number>
        </location>
        <phonииоe>0887347690</phonииоe>
        <website>СуперКафе.бг</website>
        <e-mail>СуперКафе@кафе.ком</e-mail>
    </contacts>
    <employees>
        <employee id="e190" position="Продавач" sex="Мъж">
            <emp_name>Димитър</emp_name>
            <salary>900</salary>
            <age>23</age>
        </employee>
        <employee id="e191" position="Продавач" sex="Мъж">
            <emp_name>Кайлита</emp_name>
            <salary>900</salary>
            <age>67</age>
        </employee>
    </employees>
</CoffeeHouse>
