<?xml version="1.0" encoding="utf-8"?>
<CoffeeHouse xmlns:xsi="http://www.w3.org/2001/XMLSchema-instance"
  xsi:noNamespaceSchemaLocation="file:/C:/Users/Bibi/Desktop/ASP/asp-proekt-novo-novo/XmlSample/App_Data/coffeeHouse.xsd" id="18">
  <name>Черен рай</name>
  <working_time>от 8 до 22</working_time>
  <products>
    <product id="П180">
      <price>3лв</price>
      <product_name>Шарени кафета</product_name>
      <coffee id="К1801" supplement_type="Без" drink_type="Гореща">
        <coffee_name>Капучино малина</coffee_name>
        <coffee_type>Лаваца</coffee_type>
      </coffee>
      <coffee id="К1802" supplement_type="Без" drink_type="Гореща">
        <coffee_name>Капучино лешник</coffee_name>
        <coffee_type>Лаваца</coffee_type>
      </coffee>
      <coffee id="К1803" supplement_type="Захар" drink_type="Гореща">
        <coffee_name>Дълго кафе с портокал</coffee_name>
        <coffee_type>Лаваца</coffee_type>
        <supplement_price>0.40лв</supplement_price>
      </coffee>
    </product>
  </products>
  <contacts id="С180">
    <location id="Л180">
      <country>Ромъния</country>
      <city>Брашов</city>
      <street>Хеог</street>
      <building_number>т45</building_number>
    </location>
    <phone>08765432</phone>
    <website>Черен - рай.ро</website>
    <e-mail>Черен@рай</e-mail>
  </contacts>
  <employees>
    <employee id="E180" position="Продавач" sex="Мъж">
      <emp_name>Мариан</emp_name>
      <salary>606</salary>
      <age>30</age>
    </employee>
    <employee id="E181" position="Продавач" sex="Жена">
      <emp_name>Мария</emp_name>
      <salary>987</salary>
      <age>43</age>
    </employee>
    <employee id="E182" position="Продавач" sex="Жена">
      <emp_name>Мирослава</emp_name>
      <salary>835</salary>
      <age>30</age>
    </employee>
  </employees>
</CoffeeHouse>