<?xml version="1.0" encoding="utf-8"?>
<CoffeeHouse xmlns:xsi="http://www.w3.org/2001/XMLSchema-instance"
  xsi:noNamespaceSchemaLocation="file:/C:/Users/Bibi/Desktop/ASP/asp-proekt-novo-novo/XmlSample/App_Data/coffeeHouse.xsd" id="16">
  <name>Стар Бъкс</name>
  <working_time>от 8 до 22</working_time>
  <products>
    <product id="П160">
      <price>4</price>
      <product_name>Кафета</product_name>
      <coffee id="К160" supplement_type="Без" drink_type="Гореща">
        <coffee_name>Лате малина</coffee_name>
        <coffee_type>Стар</coffee_type>
        <supplement_price>0</supplement_price>
      </coffee>
      <coffee id="К161" supplement_type="Сметана" drink_type="Студена">
        <coffee_name>Шейк праскова</coffee_name>
        <coffee_type>Стар</coffee_type>
        <supplement_price>0</supplement_price>
      </coffee>
      <coffee id="К162" supplement_type="Сметана" drink_type="Студена">
        <coffee_name>Шейк шоколад</coffee_name>
        <coffee_type>Стар</coffee_type>
        <supplement_price>0</supplement_price>
      </coffee>
      <coffee id="К163" supplement_type="Захар" drink_type="Студена">
        <coffee_name>Капучино тиква</coffee_name>
        <coffee_type>Стар</coffee_type>
        <supplement_price>0</supplement_price>
      </coffee>
      <coffee id="К164" supplement_type="Захар" drink_type="Студена">
        <coffee_name>Лате кокос</coffee_name>
        <coffee_type>Стар</coffee_type>
        <supplement_price>0</supplement_price>
      </coffee>
    </product>
    <product id="П161">
      <price>6</price>
      <product_name>Сандвич</product_name>
      <food id="Х160" food_type="Солено">
        <food_name>Сандвич с шунка</food_name>
      </food>
      <food id="Х161" food_type="Солено">
        <food_name>Сандвич с кашкавал</food_name>
      </food>
      <food id="Х162" food_type="Сладко">
        <food_name>Сандвич с плодове</food_name>
      </food>
    </product>
  </products>
  <contacts id="L2">
    <location id="C2">
      <country>България</country>
      <city>Варна</city>
      <street>Хеог</street>
      <building_number>3424</building_number>
    </location>
    <phone>08765432</phone>
    <website>Стар-бъкс.ком</website>
    <e-mail>Стар@бъксс</e-mail>
  </contacts>
  <employees>
    <employee id="E160" position="Продавач" sex="Мъж">
      <emp_name>Георги</emp_name>
      <salary>800</salary>
      <age>30</age>
    </employee>
    <employee id="E161" position="Продавач" sex="Жена">
      <emp_name>Стоян</emp_name>
      <salary>800</salary>
      <age>34</age>
    </employee>
  </employees>
</CoffeeHouse>