<?xml version="1.0" encoding="utf-8"?>
<CoffeeHouse xmlns:xsi="http://www.w3.org/2001/XMLSchema-instance"
  xsi:noNamespaceSchemaLocation="file:/C:/Users/Bibi/Desktop/ASP/asp-proekt-novo-novo/XmlSample/App_Data/coffeeHouse.xsd" id="14">
  <name>Златни</name>
  <working_time>от 8 до 22</working_time>
  <products>
    <product id="П140">
      <price>4лв.</price>
      <product_name>Кафета</product_name>
      <coffee id="К140" supplement_type="Без" drink_type="Гореща">
        <coffee_name>Късо кафе</coffee_name>
        <coffee_type>Мока</coffee_type>
      </coffee>
      <coffee id="К141" supplement_type="Без" drink_type="Гореща">
        <coffee_name>Дълго кафе</coffee_name>
        <coffee_type>Мока</coffee_type>
        <supplement_price>0</supplement_price>
      </coffee>
      <coffee id="К142" supplement_type="Мляко" drink_type="Гореща">
        <coffee_name>Мокачино банан</coffee_name>
        <coffee_type>Мока</coffee_type>
        <supplement_price>0.50лв.</supplement_price>
      </coffee>
      <coffee id="К143" supplement_type="Мляко" drink_type="Гореща">
        <coffee_name>Мокачино портокал</coffee_name>
        <coffee_type>Мока</coffee_type>
        <supplement_price>1лв.</supplement_price>
      </coffee>
    </product>
    <product id="П141">
      <price>4лв.</price>
      <product_name>Свежи кафета</product_name>
    <coffee id="К144" supplement_type="Мляко" drink_type="Студена">
        <coffee_name>Мокачино плод</coffee_name>
        <coffee_type>Мока</coffee_type>
        <supplement_price>1лв.</supplement_price>
      </coffee>
    </product>
  </products>
  <contacts id="Л14">
    <location id="C14">
      <country>България</country>
      <city>Златни пясъци</city>
      <building_number>654</building_number>
    </location>
    <phone>08765432</phone>
    <website>Златни.ком</website>
    <e-mail>Златни@кафе</e-mail>
  </contacts>
  <employees>
    <employee id="E140" position="Продавач" sex="Мъж">
      <emp_name>Михаил</emp_name>
      <salary>800</salary>
      <age>30</age>
    </employee>
    <employee id="E141" position="Готвач" sex="Жена">
      <emp_name>Петър</emp_name>
      <salary>1000</salary>
      <age>34</age>
    </employee>
  </employees>
</CoffeeHouse>